{
  "schemaVersion": "bookwriter-v4",
  "schemaRevision": 1,
  "meta": {
    "projectId": "AAT",
    "fileName": "/AAT/book.json",
    "title": "Απλή Αρμονική Ταλάντωση",
    "subtitle": "Από τον ταλαντωτή (m, k) στην κυκλική προβολή και την αρχική φάση",
    "defaultLanguage": "el",
    "authoringVersion": "bookwriter-4.5.0-rc1",
    "createdAt": "2026-07-29T15:37:37.247Z",
    "updatedAt": "2026-07-29T17:09:00.886931Z",
    "library": {
      "discipline": "Φυσική",
      "level": "Γ΄ Λυκείου",
      "category": "ΦΥΛΛΑΔΙΟ",
      "status": "Προσχέδιο",
      "tags": []
    }
  },
  "layoutDefaults": {
    "pageSize": "A4",
    "orientation": "portrait",
    "pageWidthPx": 794,
    "pageHeightPx": 1123,
    "pagePaddingTopPx": 54,
    "pagePaddingRightPx": 44,
    "pagePaddingBottomPx": 54,
    "pagePaddingLeftPx": 44,
    "headerTopPx": 20,
    "headerHeightPx": 16,
    "footerBottomPx": 18,
    "footerHeightPx": 16,
    "headerFontSize": 11,
    "footerFontSize": 11,
    "bodyFontSize": 18,
    "lineHeight": 1.3,
    "paragraphGap": 6,
    "sectionGap": 14,
    "noteGap": 8,
    "calloutGap": 7,
    "bodyFontFamily": "serif",
    "headingFontFamily": "serif",
    "heroEyebrowFontSize": 13,
    "heroTitleFontSize": 28,
    "heroSubtitleFontSize": 16,
    "heroTitleFontFamily": "serif",
    "partKickerFontSize": 10,
    "partTitleFontSize": 24,
    "partTitleFontFamily": "classic",
    "sectionHeadingFontSize": 18,
    "sectionHeadingFontFamily": "serif",
    "noteFontSize": 14,
    "noteLineHeight": 1.42,
    "noteLabelFontSize": 10.5,
    "captionFontSize": 12,
    "calloutFontSize": 11.5,
    "calloutTitleFontSize": 10.5,
    "calloutLabelFontSize": 10,
    "calloutChipFontSize": 10,
    "calloutObserveTitleFontSize": 10,
    "showPageNumbers": true
  },
  "pageDefaults": {
    "header": {
      "inherit": false,
      "left": "",
      "center": "",
      "right": ""
    },
    "footer": {
      "inherit": false,
      "left": "",
      "center": "",
      "right": "{page}"
    },
    "pageNumbering": {
      "enabled": true,
      "startAt": 1,
      "position": "footer-right",
      "hideOnFirstPage": false
    }
  },
  "nav": {
    "mode": "auto",
    "showApp": true,
    "showPrint": true,
    "groups": []
  },
  "pages": [
    {
      "id": "page-1",
      "sourcePage": null,
      "header": {
        "inherit": true,
        "left": "",
        "center": "",
        "right": ""
      },
      "footer": {
        "inherit": true,
        "left": "",
        "center": "",
        "right": ""
      },
      "pageNumbering": {
        "inherit": true,
        "enabled": true,
        "offset": 0,
        "hide": false
      },
      "items": [
        {
          "id": "hero-1",
          "type": "hero",
          "nav": {
            "show": false,
            "label": ""
          },
          "eyebrow": "",
          "title": "Απλή Αρμονική Ταλάντωση",
          "subtitle": "",
          "layout": {
            "floatInteraction": "wrap"
          }
        }
      ]
    },
    {
      "id": "page-aat-live-sequence",
      "sourcePage": null,
      "header": {
        "inherit": true,
        "left": "",
        "center": "",
        "right": ""
      },
      "footer": {
        "inherit": true,
        "left": "",
        "center": "",
        "right": ""
      },
      "pageNumbering": {
        "inherit": true,
        "enabled": true,
        "offset": 0,
        "hide": false
      },
      "items": [
        {
          "id": "aat-section-heading",
          "type": "section_heading",
          "nav": {
            "show": true,
            "label": "Ταλαντωτής και κυκλική προβολή"
          },
          "title": "Από τον ταλαντωτή (m, k) στην αρχική φάση",
          "level": 2
        },
        {
          "id": "aat-main-live-scene",
          "type": "scene",
          "nav": {
            "show": false,
            "label": ""
          },
          "src": "https://antarxo.github.io/oscillator_scenes/?state=spring&play=1",
          "title": "Ταλαντωτής (m, k) — κυκλική προβολή — γράφημα x(t)",
          "caption": "Χρησιμοποίησε διαδοχικά τα κουμπιά της σκηνής ακολουθώντας τα callouts.",
          "hideCaption": false,
          "layout": {
            "placement": "center",
            "wrap": false,
            "floatInteraction": "block",
            "widthPx": 706,
            "aspectRatio": 1.6666666666666667
          },
          "print": {
            "snapshot": true
          },
          "status": "scene"
        },
        {
          "id": "aat-callout-1-oscillator",
          "type": "interactive_callout",
          "nav": {
            "show": false,
            "label": ""
          },
          "title": "1. Ο ταλαντωτής",
          "setupLabel": "Ρύθμισε",
          "setupChips": [
            "Επαναφορά"
          ],
          "pressLabel": "Πίεσε",
          "pressChips": [
            "▶",
            "⏸"
          ],
          "observeTitle": "Παρατήρησε",
          "observeItems": [
            "Εντόπισε τις ακραίες θέσεις και τη θέση στην οποία το σώμα κινείται ταχύτερα."
          ]
        },
        {
          "id": "aat-callout-2-axis",
          "type": "interactive_callout",
          "nav": {
            "show": false,
            "label": ""
          },
          "title": "2. Άξονας αναφοράς",
          "setupLabel": "Ρύθμισε",
          "setupChips": [],
          "pressLabel": "Πίεσε",
          "pressChips": [
            "Άξονας"
          ],
          "observeTitle": "Παρατήρησε",
          "observeItems": [
            "Συσχέτισε τη θέση ισορροπίας με το 0 και τις ακραίες θέσεις με τα +A και −A."
          ]
        },
        {
          "id": "aat-callout-3-circle",
          "type": "interactive_callout",
          "nav": {
            "show": false,
            "label": ""
          },
          "title": "3. Κυκλική κίνηση",
          "setupLabel": "Ρύθμισε",
          "setupChips": [],
          "pressLabel": "Πίεσε",
          "pressChips": [
            "Κύκλος"
          ],
          "observeTitle": "Παρατήρησε",
          "observeItems": [
            "Σύγκρινε την περίοδο της κυκλικής κίνησης με την περίοδο του ταλαντωτή και την ακτίνα του κύκλου με το A."
          ]
        },
        {
          "id": "aat-callout-4-projection",
          "type": "interactive_callout",
          "nav": {
            "show": false,
            "label": ""
          },
          "title": "4. Προβολή",
          "setupLabel": "Ρύθμισε",
          "setupChips": [],
          "pressLabel": "Πίεσε",
          "pressChips": [
            "Προβολή"
          ],
          "observeTitle": "Παρατήρησε",
          "observeItems": [
            "Παρακολούθησε τη στικτή γραμμή και έλεγξε ότι προβολή και σώμα έχουν συνεχώς την ίδια απομάκρυνση."
          ]
        },
        {
          "id": "aat-callout-5-graph",
          "type": "interactive_callout",
          "nav": {
            "show": false,
            "label": ""
          },
          "title": "5. Γράφημα x(t)",
          "setupLabel": "Ρύθμισε",
          "setupChips": [],
          "pressLabel": "Πίεσε",
          "pressChips": [
            "Γράφημα"
          ],
          "observeTitle": "Παρατήρησε",
          "observeItems": [
            "Παρακολούθησε το στικτό σημείο του γραφήματος και τις διαδοχικές ακέραιες περιόδους nT."
          ]
        },
        {
          "id": "aat-callout-6-phase",
          "type": "interactive_callout",
          "nav": {
            "show": false,
            "label": ""
          },
          "title": "6. Αρχική φάση",
          "setupLabel": "Ρύθμισε",
          "setupChips": [
            "φ₀"
          ],
          "pressLabel": "Πίεσε",
          "pressChips": [
            "Αρχική φάση",
            "Τώρα → t=0"
          ],
          "observeTitle": "Παρατήρησε",
          "observeItems": [
            "Συσχέτισε την αρχική θέση x₀ και το πρόσημο της υ₀ με την αρχική θέση στον κύκλο και έλεγξε ότι αλλάζει η αρχή του χρόνου, όχι η κίνηση."
          ]
        }
      ]
    }
  ],
  "importManifest": {
    "version": 1,
    "insertions": []
  },
  "extensions": {}
}